"tweet_id","in_reply_to_status_id","in_reply_to_user_id","retweeted_status_id","retweeted_status_user_id","timestamp","source","text","expanded_urls"
"17891711","17884951","1455981","","","2007-04-02 19:42:45 +0000","web","@eston you suck.  i owed a whopper to the gov't. summer + class - job = suck."
"17889861","","","","","2007-04-02 19:40:00 +0000","web","westerns/dinner until (ugh) marketing."
"17859391","17858221","635653","","","2007-04-02 18:53:38 +0000","web","@phlops problem with POP is that you're left with two copies and you spend more time managing both inboxes than you do addressing emails."
"17851661","","","","","2007-04-02 18:41:27 +0000","web","and Gmail's back.  That was making me nervous.  Web apps need local access."
"17850011","17847231","1455981","","","2007-04-02 18:39:06 +0000","im","@eston wow, that's really cool.  Go 9rulers."
"17846791","","","","","2007-04-02 18:34:09 +0000","web","uhhh, Gmail's giving me internal server errors.  Grrrr..."
"17843431","","","","","2007-04-02 18:29:31 +0000","im","ordered graduation announcements and diploma frame.  This is becoming too real."
"17820591","17816121","1455981","","","2007-04-02 17:55:59 +0000","im","@eston yes, he certainly does.  that whole sequence in the hotel room has an awkward feeling to it."
"17806801","17758781","1455981","","","2007-04-02 17:27:23 +0000","web","@eston CNN piece on Kathy Sierra http://tinyurl.com/2gz7w9"
"17767331","","","","","2007-04-02 16:26:04 +0000","<a href=""http://twitter.com/devices"" rel=""nofollow"">txt</a>","That was an intense haircut.  She took a lot off.  Feels good though."
"17742671","","","","","2007-04-02 15:51:28 +0000","<a href=""http://twitter.com/devices"" rel=""nofollow"">txt</a>","Listening to This American Life and eating, two very good things."
"17698841","","","","","2007-04-02 14:50:01 +0000","<a href=""http://twitter.com/devices"" rel=""nofollow"">txt</a>","Hmmm, now we're watching an original episode from Star Trek Next Generation"
"17688631","","","","","2007-04-02 14:35:12 +0000","<a href=""http://twitter.com/devices"" rel=""nofollow"">txt</a>","Little sleep and thus tired and feeling a little sick.  Here's to Sci-Fi class wrapping up, so I can eat, shower and (ugh) watch Westerns."
"17519561","","","","","2007-04-02 08:11:20 +0000","web","head hurts.  Must mean bed time. These late nights need to come to an end."
"17507261","17500351","1455981","","","2007-04-02 07:33:49 +0000","web","@eston: sorry. Gtalk didn't update. Wait til you see last issue of E3W. My farewell letter's going in, along with a pic you'll enjoy."
"17488371","17482271","1455981","","","2007-04-02 06:38:12 +0000","im","@eston you still up?"
"17442841","17441391","1455981","","","2007-04-02 04:49:32 +0000","im","@eston too bad ill be in florida by then.  also, we need to watch casino royale soooon."
"17440691","","","","","2007-04-02 04:44:14 +0000","im","free advance screening of The Reaping on Wed at 7: http://www.apple.com/trailers/wb/thereaping/trailer2/ who wants to come?"
"17440061","17436001","1455981","","","2007-04-02 04:42:16 +0000","im","@eston yesssss, it's finally coming: http://tinyurl.com/2v8n5v"
"17434721","17433401","3085101","","","2007-04-02 04:29:14 +0000","im","@thebus yeah i may be, too."
"17428631","","","","","2007-04-02 04:16:59 +0000","web","holy crap: ""...of the earth?s 6.3 billion people, 3 billion have cellphones."" http://tinyurl.com/yp2onp"
"17424441","","","","","2007-04-02 04:06:02 +0000","web","EMI's pulling DRM today: http://online.wsj.com/article/SB117547255583356319.html"
"17411771","","","","","2007-04-02 03:35:57 +0000","web","this program kick's ass.  I might put up the World Tour spread somewhere..."
"17339021","","","","","2007-04-02 00:56:59 +0000","web","laundry, dinner, sublet agreement, E3W departure letter, program revisions, Westerns.  Busy night."
"17315601","","","","","2007-04-02 00:02:55 +0000","web","good article from the NYTimes about being busy: http://www.nytimes.com/2007/03/31/business/31shortcuts.html"
"17253981","","","","","2007-04-01 21:44:20 +0000","<a href=""http://twitter.com/devices"" rel=""nofollow"">txt</a>","A guy at Pub Staff thought Google Paper was real.  n00b."
"17242231","","","","","2007-04-01 21:19:29 +0000","<a href=""http://twitter.com/devices"" rel=""nofollow"">txt</a>","Ugh.  Frustrating afternoon.  Pub Staff, Club, dinner."
"17224131","","","","","2007-04-01 20:43:06 +0000","im","testing Google Talk on Chatopus via the Treo."
"17206011","","","","","2007-04-01 20:04:39 +0000","web","Probably going to uninstall Palm, delete registry entries, etc., per this KB article: http://tinyurl.com/3de8vv"
"17204981","","","","","2007-04-01 20:02:30 +0000","web","stressed out cause my Treo won't sync.  Conduit issues.  This could get intense."
"17186861","","","","","2007-04-01 19:21:19 +0000","im","holy crap.  Program, for the most part, is done."
"17132581","17115851","1455981","","","2007-04-01 17:30:53 +0000","im","@eston what's that good site for adium extras?"
"17103881","","","","","2007-04-01 16:27:43 +0000","im","question:  can I make today as productive as yesterday?  answer: yes, but it'll take work."
"17101611","","","","","2007-04-01 16:21:54 +0000","im","weird. two people called me within 15 minutes of each other returning day old calls i made to them."
"17101391","","","","","2007-04-01 16:21:29 +0000","im","@kmoher that sucks.  hope you're not out too late."
"16938831","","","","","2007-04-01 07:50:30 +0000","web","it's way too late.  bed."
"16938681","16937621","1455981","","","2007-04-01 07:50:11 +0000","web","@eston you need a twitter pic"
"16928921","","","","","2007-04-01 07:11:56 +0000","web","ooo, I can hear rain and thunder out my window.  I should go to bed, so I can listen to it as I fall asleep."
"16925341","","","","","2007-04-01 07:01:16 +0000","web","this program is beastly.  The world map will be sweet though, once I finish it tomorrow."
